"id","arquivo","titulo","autores","ano","abstract","keywords","doi","veiculo_publicacao","num_paginas","num_referencias","tamanho_amostra","metodologia","areas_pesquisa","metricas_mencionadas","metodos_estatisticos","ferramentas_tecnologias","padroes_normas","contexto_dominio","idioma","caminho_pdf"
"24","Application of Statistical Methods in Software Engineering Theory and Practice.pdf","Application of Statistical Methods in Software Engineering: Theory and Practice","Tassio Sirqueira, Marcos Miguel, Humberto Dalpra, Marco Antônio Araújo, José Maria David","","The experimental evaluation of the methods and concepts covered in software engineering has been increasingly valued. This value indicates the constant search for new forms of assessment and validation of the results obtained in Software Engineering research. Results are validated in studies through evaluations, which in turn become increasingly stringent. As an alternative to aid in the veriﬁcation of the results, that is, whether they are positive or negative, we suggest the use of statistical methods. This article presents some of the main statistical techniques available, as well as the...","Statistical Methods; Experimental Studies; Software Engineering; Experimental Evaluation","","","23","41","","Análise Estatística","Experimentação","","Teste t; Mann-Whitney; ANOVA; Kruskal-Wallis; Correlação de Pearson; Shapiro-Wilk; Kolmogorov-Smirnov; Descritiva; Box Plot; Teste de Normalidade; Precisão/Recall/F1","","CMMI","Indústria; Acadêmico","EN","../data/raw/artigos/Application of Statistical Methods in Software Engineering Theory and Practice.pdf"
"25","Do Internal Software Metrics Have Relationship with Fault-proneness and Change-proneness.pdf","arXiv:2310.03673v2 [cs.SE] 7 Jun 2024","","2024","Fault-proneness is a measure that indicates the possibility of pro- gramming errors occurring within a software system. On the other hand, change-proneness refers to the potential for modiﬁcations to be made to the software. Both of these measures are crucial indicators of software maintainability, as they inﬂuence internal software metrics such as size, inheritance, and coupling, particu- larly when numerous changes are made to the system. In the liter- ature, research has predicted change- and fault-proneness using internal software metrics that is almost a decade old. However, given the ...","change-proneness, fault-proneness, internal software metrics","","","7","18","","Estudo Empírico","Métricas de Software; Qualidade de Software; Manutenção de Software; Predição de Defeitos","LOC/SLOC; Coupling/Acoplamento; Cohesion/Coesão","Correlação de Spearman","GitHub; JIRA; Java; Eclipse","ISO/IEC 9126","Open Source; Indústria; Acadêmico","EN","../data/raw/artigos/Do Internal Software Metrics Have Relationship with Fault-proneness and Change-proneness.pdf"
"26","Evaluation metrics and statistical tests for machine learning.pdf","Evaluation metrics and statistical tests for machine learning","Oona Rainio","2024","","Evaluation metrics, Machine learning, Medical images, Statistical testing Due to our developed technology and access to huge amounts of digitized data, the number of different appli- cations using machine learning (ML) has increased dramatically during the past few ­decades","10.1038/s41598-024-56706-x","","14","123","","Machine Learning","Inteligência Artificial/ML","Complexidade Ciclomática","Teste t; Mann-Whitney; Wilcoxon; Correlação de Pearson; Correlação de Spearman; K-fold/Cross-validation; ROC/AUC; Precisão/Recall/F1","GitHub; Python","","Indústria; Acadêmico; Saúde/Healthcare; Financeiro; Educação","EN","../data/raw/artigos/Evaluation metrics and statistical tests for machine learning.pdf"
"27","Evaluation of Software Product Quality Metrics.pdf","Evaluation of Software Product Quality Metrics","","2009","Computing devices and associated software govern everyday life, and form the backbone of safety critical systems in banking, health- care, automotive and other ﬁelds. Increasing system complexity, quickly evolving technologies and paradigm shifts have kept software quality re- search at the forefront. Standards such as ISO’s 25010 express it in terms of sub-characteristics such as maintainability, reliability and security. A signiﬁcant body of literature attempts to link these subcharacteristics with software metric values, with the end goal of creating a metric- based model of software pro...","software metric, software quality, descriptive statistics, cross- sectional study, longitudinal study","","","24","1993","","","Métricas de Software; Qualidade de Software; Manutenção de Software; Gerenciamento de Projetos; Segurança de Software","LOC/SLOC; Coupling/Acoplamento; Halstead","Correlação de Spearman; Descritiva; Precisão/Recall/F1","Java; Eclipse","ISO/IEC 25010 (SQuaRE); ISO/IEC 9126; McCall Model; Boehm Model","Open Source; Acadêmico; Saúde/Healthcare; Financeiro","EN","../data/raw/artigos/Evaluation of Software Product Quality Metrics.pdf"
"28","Evidence_is_All_We_Need_Do_Self-Admitted_Technical_Debts_Impact_Method-Level_Maintenance.pdf","Evidence is All We Need: Do Self-Admitted Technical Debts Impact Method-Level Maintenance?","","","Self-Admitted Technical Debt (SATD) refers to the phenomenon where developers explicitly acknowledge technical debt through comments in the source code. While considerable research has focused on detecting and addressing SATD, its true impact on software maintenance remains underexplored. The few studies that have examined this critical aspect have not provided concrete evidence linking SATD to negative effects on software maintenance. These studies, however, focused only on file- or class-level code granularity. This paper aims to empirically investigate the influence of SATD on various fa...","","","","13","89","49","Mineração de Repositórios","Métricas de Software; Qualidade de Software; Manutenção de Software; Revisão de Código; Dívida Técnica","Code Coverage; Technical Debt","Wilcoxon; Correlação de Pearson; Effect Size; Shapiro-Wilk; Kolmogorov-Smirnov; Teste de Normalidade; Precisão/Recall/F1","SonarQube; GitHub; Java; Visual Studio; ChatGPT/GPT; Snowball/Scopus/IEEE Xplore; Google Scholar","","Open Source; Acadêmico","EN","../data/raw/artigos/Evidence_is_All_We_Need_Do_Self-Admitted_Technical_Debts_Impact_Method-Level_Maintenance.pdf"
"29","Experimentation in Software Engineering.pdf","Experimentation in Software Engineering","","","Experimentation in software engineering supports the ad- vancement of the field through an iterative learning process. In this paper we present a framework for analyzing most of the experimental work performed in software engineering over the past several years. We describe a variety of experiments in the framework and discuss their contribution to the software engineering discipline. Some useful recommendations for the application of the experimental process in software engineering are included.","","","","11","116","74","Experimento Controlado; Estudo Empírico; Proposta de Framework; Replicação","Métricas de Software; Experimentação","Coupling/Acoplamento","Teste t; Bayesiana; Precisão/Recall/F1","Understand (SciTools)","McCall Model; Boehm Model","Acadêmico; Educação","EN","../data/raw/artigos/Experimentation in Software Engineering.pdf"
"30","FORMATO PARA ESPECIFICAÇÃO DE REQUISITOS CONJECTURAIS NO CONTEXTO DA EXPERIMENTAÇÃO CONTÍNUA EM ENGENHARIA DE SOFTWARE.pdf","FORMATO PARA ESPECIFICAÇÃO DE REQUISITOS CONJECTURAIS NO","Nome Completo do Autor","2023","","","","IST","112","200","16","Proposta de Framework","Experimentação","","Correlação de Pearson","","GQM","Educação","PT","../data/raw/artigos/FORMATO PARA ESPECIFICAÇÃO DE REQUISITOS CONJECTURAIS NO CONTEXTO DA EXPERIMENTAÇÃO CONTÍNUA EM ENGENHARIA DE SOFTWARE.pdf"
"31","How to Accelerate R&D and Optimize Experiment Planning with Machine Learning and Data Science.pdf","05_Roche_01_43122.indd","","2023","Accelerating R&D is essential to address some of the challenges humanity is currently facing, such as achieving global sustainability goals. Today’s Edisonian approach of trial-and-error still prevalent in R&D labs takes up to two decades of fundamental and applied research for new materials to reach the market. Turning around this situation calls for strategies to upgrade R&D and expedite innovation. By conducting smart experi- ment planning that is data-driven and guided by AI/ML, researchers can more efficiently search through the com- plex – often constrained – space of possible experim...","","10.2533/chimia.2023.7","","10","0","","Proposta de Framework; Machine Learning","Experimentação; Inteligência Artificial/ML","","Bayesiana; SVM","Python","","Acadêmico; Financeiro; Educação","EN","../data/raw/artigos/How to Accelerate R&D and Optimize Experiment Planning with Machine Learning and Data Science.pdf"
"32","Impact_of_CMMI_based_software_process_maturity_on_.pdf","Microsoft Word - 725final","faten","2008","The software capability maturity model has become a popular model for enhancing software development processes with the goal of developing high-quality software within budget and schedule. The software cost estimation model, constructive cost model, in its last update (constructive cost model II) has a set of seventeen cost drivers and a set of five scale factors. Process maturity is one of the five scale factors and its ratings are based on software capability maturity model. This paper examines the effect of process maturity on software development effort by deriving a new set of construc...","Effort estimation, scale factor, cost driver, COCOMO, SW-CMM, CMMI","","","10","34","161","","Gerenciamento de Projetos; Processo de Software","Cohesion/Coesão","Bayesiana","","CMMI; GQM; Boehm Model","Indústria; Acadêmico","EN","../data/raw/artigos/Impact_of_CMMI_based_software_process_maturity_on_.pdf"
"33","Impact_of_Evaluating_Software_Complexity_Measures.pdf","Impact of &#x201C;Evaluating Software Complexity Measures&#x201D;","","2025","We investigate the impact that the paper “Evaluat- ing Software Complexity Measures” has had over the thirty-six year period since it was ﬁrst published in 1988. We look both at how the frequency of citation increased, and the ways that the research has been used. We describe how citations evolved from the initial obvious intent of assessing newly proposed complexity measures to assessing qualities other than complexity, to using them to assess complexity in entities other than software code, or restricted types of programming paradigms, to the adoption of our approach or properties in ﬁeld...","Software engineering, software metrics, software measurement. I. BACKGROUND I N December","10.1109/TSE.2025.3533467","TSE","5","14","","","Métricas de Software; Teste de Software","","SVM; Precisão/Recall/F1","Snowball/Scopus/IEEE Xplore; Google Scholar","","Acadêmico","EN","../data/raw/artigos/Impact_of_Evaluating_Software_Complexity_Measures.pdf"
"34","Kitchenham, B. Guidelines for performing Systematic Literature Reviews in software engineering. EBSE Technical Report EBSE-2007-01.pdf","Undertaking systematic reviews","A satisfied Microsoft Office User","2007","","","","","65","29","10","Revisão Sistemática; Mapeamento Sistemático","Engenharia de Software (Geral)","","Effect Size; K-fold/Cross-validation; Precisão/Recall/F1","","Boehm Model","Indústria; Acadêmico","EN","../data/raw/artigos/Kitchenham, B. Guidelines for performing Systematic Literature Reviews in software engineering. EBSE Technical Report EBSE-2007-01.pdf"
"35","LLM4DS Evaluating Large Language Models for Data Science Code Generation.pdf","LLM4DS: Evaluating Large Language Models for","","","The adoption of Large Language Models (LLMs) for code generation in data science offers substantial potential for en- hancing tasks such as data manipulation, statistical analysis, and visualization. However, the effectiveness of these models in the data science domain remains underexplored. This paper presents a controlled experiment that empirically assesses the performance of four leading LLM-based AI assistants—Microsoft Copilot (GPT-4 Turbo), ChatGPT (o1-preview), Claude (3.5 Sonnet), and Perplexity Labs (Llama-3.1-70b-instruct)—on a diverse set of data science coding challenges source...","","","ASE","11","21","100","Experimento Controlado; Estudo Empírico; Proposta de Framework; Análise Estatística; GQM","Experimentação; Inteligência Artificial/ML; Produtividade","","Wilcoxon; Chi-quadrado; Kruskal-Wallis; Regressão Linear; Descritiva; Box Plot","GitHub; Python; ChatGPT/GPT; GitHub Copilot","GQM","Open Source; Acadêmico","EN","../data/raw/artigos/LLM4DS Evaluating Large Language Models for Data Science Code Generation.pdf"
"36","Measuring_the_Impact_of_Scope_Changes_on_Project_Plan_Using_EVM.pdf","Received August 6, 2020, accepted August 13, 2020, date of publication August 20, 2020, date of current version September 2, 2020.","","2020","Earned Value Management (EVM) measures project performance against a baseline plan. It identiﬁes deviations in budget and schedule, aids project managers in taking earlier corrective actions against cost and schedule overruns. Although the literature highlights the signiﬁcance of scope by adopting it as a leading indicator to measure project success or failure. However, EVM does not include scope when evaluating the performance of any software project. While considering the importance of scope and its ever-changing nature, it is imperative to measure the effect of changes in scope on the pr...","","10.1109/ACCESS.2020.3018169","","25","94","","","Gerenciamento de Projetos","","Correlação de Pearson; Regressão Linear; Regressão Logística; Descritiva","SPSS; COSMIC; Snowball/Scopus/IEEE Xplore","","Acadêmico","EN","../data/raw/artigos/Measuring_the_Impact_of_Scope_Changes_on_Project_Plan_Using_EVM.pdf"
"37","Medição e Análise no CMMI com Metodologia Seis Sigma eISOIECIEEE1593.pdf","Sigmae, Alfenas, v.11, n.2, p. 21-35, 2022.","DEX","2022","Based on the premise that the quality of a software product is mostly the result of the quality of the process in which it is developed, models for the improvement of the process of software have been developed. The measurement and analysis for models assume great importance, because the evaluation of the relationship between the capacity (estimated results) and the performance (observed results) of a process is important so that it can be improved. CMMI is one of the more used models, having a great experience with success in the industry. CMMI do not indicate the measurement system to wor...","CMMI; Statistics; Six Sigma; ISO/IEC/","","","15","0","","Estudo de Caso","Processo de Software","","","","ISO/IEC 15939; CMMI; Six Sigma","Indústria; Acadêmico","PT","../data/raw/artigos/Medição e Análise no CMMI com Metodologia Seis Sigma eISOIECIEEE1593.pdf"
"38","Metrics for Evaluating and Improving Transparency in Software Engineering An Empirical Study and Improvement Model.pdf","Metrics for Evaluating and Improving Transparency in Software Engineering: An Empirical Study and Improvement Model","Paulinus Ofem","2024","Transparency remains an emerging non-functional requirement that stakeholders in the software engineering process (SEP) must consider. Existing studies provide evidence of the usefulness of transparency and offer hindsight on how transparency may be evaluated in different contexts. Considering communication, software maintainability, and stakeholders’ productivity, SEP has not thoroughly explored the benefits of transparency. Currently, there is no appropriate measurement of transpar- ency in SEP, and the consequence of this is that theoretically and empirically, the factors that characteri...","","10.1007/s42979-024-03471-3","","35","145","226","Revisão Sistemática; Experimento Controlado; Estudo Empírico; Proposta de Framework; GQM","Manutenção de Software; Experimentação; Processo de Software; Produtividade","","Teste t; Correlação de Pearson; Regressão Linear; Effect Size; Descritiva; Precisão/Recall/F1","SPSS; Understand (SciTools)","GQM","Acadêmico","EN","../data/raw/artigos/Metrics for Evaluating and Improving Transparency in Software Engineering An Empirical Study and Improvement Model.pdf"
"39","Metrics in Large-Scale Agile Software Development A Multivocal Literature Review.pdf","Metrics in Large-Scale Agile Software Development: A","","2021","Software development is widespread across various sectors. As large- scale projects increasingly adopt agile development practices, there arises a need for metrics to enhance team coordination, promote continuous improve- ment and monitor progress. This discussion focuses on the current state of metrics for large-scale agile software development, outlining the reasons for their adoption and showcasing the achieved results. The analysis involves a comprehensive literature review, exploring grey literature. A catalog of metrics applicable to scalable agile projects is presented, featuring exa...","","","","15","0","","Revisão Multivocal","Métricas de Software; Métodos Ágeis; Produtividade","LOC/SLOC; Function Points; Story Points; Velocity; Lead Time","Precisão/Recall/F1","Snowball/Scopus/IEEE Xplore","GQM","Indústria; Acadêmico","EN","../data/raw/artigos/Metrics in Large-Scale Agile Software Development A Multivocal Literature Review.pdf"
"40","On Wasted Contributions Understanding the Dynamics of Contributor-Abandoned Pull Requests–A Mixed-Methods Study of 10 Large Open-Source Projects.pdf","On Wasted Contributions: Understanding the Dynamics","","2023","","and Phrases: Socio-technical factors, pull-based development, modern code review, social coding platforms, open-source software, mixed-methods research","10.1145/3530785","","39","82","7","Survey/Questionário; Estudo Empírico; Machine Learning","Inteligência Artificial/ML; Revisão de Código","","Correlação de Spearman; Effect Size; Box Plot; Random Forest; K-fold/Cross-validation; ROC/AUC; Precisão/Recall/F1","GitHub; Python; R (Estatístico); Java; scikit-learn; Kubernetes","","Open Source; Acadêmico; Educação","EN","../data/raw/artigos/On Wasted Contributions Understanding the Dynamics of Contributor-Abandoned Pull Requests–A Mixed-Methods Study of 10 Large Open-Source Projects.pdf"
"41","On the Relationship Between Story Points and DevelopmentEffort in Agile Open-Source Software.pdf","On the Relationship Between Story Points and Development Effort in Agile Open-Source Software","Vali Tawosi, Rebecca Moussa, Federica Sarro","","","Software effort estimation; Story Point; Agile software","10.1145/3544902.3546238","","12","58","44","Estudo de Caso; Estudo Empírico","Engenharia de Software Empírica; Métodos Ágeis; Gerenciamento de Projetos","Function Points; Story Points","Mann-Whitney; Wilcoxon; Correlação de Pearson; Correlação de Spearman; Effect Size; Shapiro-Wilk; Descritiva; Box Plot; Random Forest; Precisão/Recall/F1","GitHub; JIRA; R (Estatístico); COSMIC","","Open Source; Acadêmico","EN","../data/raw/artigos/On the Relationship Between Story Points and DevelopmentEffort in Agile Open-Source Software.pdf"
"42","Process metrics for software defectprediction in object-oriented programs.pdf","Process metrics for software defect prediction in object‐oriented programs","","2018","Software evolution is an important activity in the life cycle of a modern software system. In the process of software evolution, the repair of historical defects and the increasing demands may introduce new defects. Therefore, evolution-oriented defect prediction has attracted much attention of researchers in recent years. At present, some researchers have proposed the process metrics to describe the characteristics of software evolution. However, compared with the traditional software defect prediction methods, the research on evolution-oriented defect prediction is still inadequate. Based...","","10.1049/iet-sen.2018.5439","","10","57","","Estudo Empírico","Métricas de Software; Segurança de Software; Predição de Defeitos","Code Churn; Halstead; Defect Density","Wilcoxon; Correlação de Pearson; Regressão Linear; Regressão Logística; Effect Size; Bayesiana; ROC/AUC; Precisão/Recall/F1","Java; Weka; Eclipse","","Open Source; Acadêmico; Educação","EN","../data/raw/artigos/Process metrics for software defectprediction in object-oriented programs.pdf"
"43","Quality_metrics_in_Agile_Software_Development_Proj.pdf","Quality Metrics in Agile Software Development Projects","Kristīne Kārkliņa, Rūta Pirta","2018","– Nowadays, IT projects are becoming more complex and larger in scale. Stakeholders often experience difficulties assessing project quality attributes, such as progress, budget. Specifically adapted project metrics based on their descriptive features are beneficial tools for acquiring important information. The paper discusses metrics as an important project quality assessment method. It proposes using GQM method for selecting the most appropriate Agile project quality metrics. For metrics monitoring it explores popular cloud-based project management systems. An illustration of the approach...","","10.7250/itms-2018-0008","","6","20","","Estudo de Caso; GQM","Métricas de Software; Métodos Ágeis; Gerenciamento de Projetos","Velocity","Precisão/Recall/F1","JIRA","GQM","Indústria; Acadêmico; Financeiro","EN","../data/raw/artigos/Quality_metrics_in_Agile_Software_Development_Proj.pdf"
"44","Quality_of_AI-Generated_vs._Human-Generated_Code.pdf","Quality of AI-Generated vs. Human-Generated Code","","","This study examines the quality differences between AI-generated and human-generated code through an evaluation of multiple software quality metrics, including maintainability, complexity, and documentation. Using a dataset of 5,312 code samples—2,700 human-generated and 2,612 AI-generated—we applied machine learning techniques to classify and analyze the code based on these metrics. The results revealed that AI-generated code tends to excel in maintainability and doc- umentation, demonstrating higher maintainability index scores and a higher ratio of comments. Additionally, AI-generated co...","","","","6","16","5","Survey/Questionário; Machine Learning","Métricas de Software; Qualidade de Software; Manutenção de Software; Inteligência Artificial/ML","Complexidade Ciclomática","Random Forest; SVM; Precisão/Recall/F1","GitHub; Python; Java; ChatGPT/GPT; Snowball/Scopus/IEEE Xplore","Boehm Model","Indústria; Acadêmico; Educação","EN","../data/raw/artigos/Quality_of_AI-Generated_vs._Human-Generated_Code.pdf"
"45","Recommendations for analysing and meta-analysing small sample size software engineering experiments.pdf","https://doi.org/10.1007/s10664-024-10504-1","","2024","","Meta-analysis · Effect size · Non-parametric · Probability of superiority · Small sample sizes · Reproducible research Communicated by: Carlo A. Furia B Lech Madeyski lech.madeyski@pwr.edu.pl","10.1007/s10664-024-10504-1","Empirical Software Engineering","46","114","9","Experimento Controlado; Meta-análise; Análise Estatística","Engenharia de Software Empírica; Experimentação","","Mann-Whitney; Chi-quadrado; Effect Size; Shapiro-Wilk; Box Plot; Teste de Normalidade","R (Estatístico)","","Acadêmico","EN","../data/raw/artigos/Recommendations for analysing and meta-analysing small sample size software engineering experiments.pdf"
"46","Robust Statistical Methods for Empirical Software Engineering.pdf","Empir Software Eng (2017) 22:579–630","","2017","","Empirical software engineering · Statistical methods · Robust methods · Robust statistical methods","10.1007/s10664-016-9437-5","","53","200","38","Revisão Sistemática; Análise Estatística","Métricas de Software; Engenharia de Software Empírica","","Teste t; Mann-Whitney; Wilcoxon; ANOVA; Kruskal-Wallis; Effect Size; Shapiro-Wilk; Kolmogorov-Smirnov; Bootstrap; Box Plot; Teste de Normalidade; ROC/AUC; Precisão/Recall/F1","R (Estatístico)","Boehm Model","Acadêmico","EN","../data/raw/artigos/Robust Statistical Methods for Empirical Software Engineering.pdf"
"47","SOFTWARE CODE QUALITY MEASUREMENT IMPLICATIONS FROM METRIC DISRIBUTIONS.pdf","SOFTWARE CODE QUALITY MEASUREMENT: IMPLICATIONS FROM","","2024","Software code quality is a construct with three dimensions: maintainability, reliability, and func- tionality. Although many firms have incorporated code quality metrics in their operations, evalu- ating these metrics still lacks consistent standards. We categorized distinct metrics into two types: 1) monotonic metrics that consistently influence code quality; and 2) non-monotonic metrics that lack a consistent relationship with code quality. To consistently evaluate them, we proposed a distribution-based method to get metric scores. Our empirical analysis includes 36,460 high-quality open-...","open source software, code quality, construct measurement, non-monotonic metric","","IST","12","34","","Machine Learning","Manutenção de Software; Inteligência Artificial/ML; Revisão de Código","","ROC/AUC","SonarQube; GitHub; Python; Java","ISO/IEC 25010 (SQuaRE); ISO 9001","Open Source; Acadêmico; Educação","EN","../data/raw/artigos/SOFTWARE CODE QUALITY MEASUREMENT IMPLICATIONS FROM METRIC DISRIBUTIONS.pdf"
