"id","arquivo","titulo","autores","ano","abstract","keywords","doi","veiculo_publicacao","num_paginas","num_referencias","tamanho_amostra","metodologia","areas_pesquisa","metricas_mencionadas","metodos_estatisticos","ferramentas_tecnologias","padroes_normas","contexto_dominio","idioma","caminho_pdf"
"48","Software Development and Maintenance Effort Estimation Using Function Points and Simpler Functional Measures.pdf","Software Development and Maintenance Effort Estimation Using Function Points and Simpler Functional Measures","Luigi Lavazza, Angela Locoro and Roberto Meli","2024","Functional size measures are widely used for estimating software development effort. After the","unadjusted Function Points (UFPs); simple Function Points (SFPs); effort estimation; simple functional size measures","10.3390/software3040022","","31","94","1307","Estudo Empírico","Gerenciamento de Projetos","Function Points","Bayesiana; Descritiva; Box Plot","Jenkins; COSMIC; IFPUG","Boehm Model","Indústria; Acadêmico","EN","../data/raw/artigos/Software Development and Maintenance Effort Estimation Using Function Points and Simpler Functional Measures.pdf"
"49","Software Process Measurement and Related Challenges in Agile Software Development A Multiple Case Study.pdf","Microsoft Word - Software Process Measurement and Related Challenges in Agile Software Developmen - A Multiple Case Study (Latest)","pram","2020","Existing scientific literature highlights the importance of metrics in Agile Software Development (ASD). Still, empirical investigation into metrics in ASD is scarce, particularly in identifying the rationale and the operational chal- lenges associated with metrics. Under the Q-Rapids project (Horizon 2020), we conducted a multiple case study at four Agile companies. We used the Goal Ques- tion Metric (GQM) approach to investigate the rationale explaining the choice of process metrics in ASD, and challenges faced in operationalizing them. Results reflect that companies are interested in ass...","Process Metrics, Agile Software Development, GQM","","","16","75","","Revisão Sistemática; Estudo de Caso; Estudo Empírico; GQM","Métricas de Software; Métodos Ágeis; Processo de Software","Velocity","Precisão/Recall/F1","JIRA","GQM","Indústria; Acadêmico","EN","../data/raw/artigos/Software Process Measurement and Related Challenges in Agile Software Development A Multiple Case Study.pdf"
"50","Software Product Quality Metrics A Systematic Mapping Study.pdf","Software Product Quality Metrics: A Systematic Mapping Study","","2021","The result is presented through graphics, explanations, and the mind mapping method. The outputs include the trend map between the years 2009 and 2019, knowledge about this area and measurement tools, issues determined to be open to development in this area, and conformity between conference papers, articles and internationally valid quality models. This study may serve as a foundation for future studies that aim to contribute to the development in this crucial ﬁeld. Future SM studies might focus on this subject for measuring the quality of network performance and new technologies such as A...",", quality assessment is applied for each paper. The quality assessment is realized based on the three questions to evaluate the completeness, consistency, and relevance of the selected study. The questions below are derived from the previous studies of Kitchenham et al. [34] and other SM studies. Q","10.1109/ACCESS.2021.3054730","","24","60","","Mapeamento Sistemático; Machine Learning","Qualidade de Software; Inteligência Artificial/ML","","Correlação de Pearson; Precisão/Recall/F1","Java; Understand (SciTools); COSMIC; IFPUG; Snowball/Scopus/IEEE Xplore; Google Scholar","ISO/IEC 25010 (SQuaRE); ISO/IEC 9126; CMMI; GQM; ISO 9001; SWEBOK","Indústria; Acadêmico; Educação","EN","../data/raw/artigos/Software Product Quality Metrics A Systematic Mapping Study.pdf"
"51","Software quality models Exploratory review.pdf","This is a title","erika","2023","INTRODUCTION: The emerging industrialization of software promotes the continuous development of new evaluation models that adapt to the product's characteristics and the organizations' needs. OBJECTIVES: This article aims to identify the software quality models proposed between 2016 and 2020. METHODS: We conducted an exploratory systematic review in the SciELO, IEEE Xplore, and Scopus databases, resulting in 14 research papers proposing new models for assessing software quality. RESULTS: 79% of the research papers were extracted from IEEE Xplore, and 50% of them were authored by individuals...","product quality, quality of use, quality standards, software development, systematic review Received on","10.4108/eetsis.3982","","7","37","","Revisão Sistemática","Qualidade de Software; Processo de Software","","","Snowball/Scopus/IEEE Xplore; Google Scholar","ISO/IEC 25010 (SQuaRE); ISO/IEC 9126; CMMI; ISO 9001","Indústria","PT","../data/raw/artigos/Software quality models Exploratory review.pdf"
"52","Software_Cost_and_Effort_Estimation_Current_Approaches_and_Future_Trends.pdf","Received 20 August 2023, accepted 31 August 2023, date of publication 7 September 2023, date of current version 15 September 2023.","","2023","Software cost and effort estimation is one of the most significant tasks in the area of software engineering. Research conducted in this field has been evolving with new techniques that necessitate periodic comparative analyses. Software project success largely depends on accurate software cost estimation as it gives an idea of the challenges and risks involved in the development. The great diversity of ML and Non- ML techniques has generated a comparison and progressed into the integration of these techniques. Based on varying advantages it has become imperative to work out preferred estim...","","10.1109/ACCESS.2023.3312716","IST","21","121","","Revisão Sistemática; Machine Learning","Gerenciamento de Projetos; Inteligência Artificial/ML","Function Points","Wilcoxon; Regressão Linear; SVM","JIRA; Jenkins; R (Estatístico); Snowball/Scopus/IEEE Xplore","CMMI; Boehm Model","Indústria; Acadêmico; Financeiro; Educação","EN","../data/raw/artigos/Software_Cost_and_Effort_Estimation_Current_Approaches_and_Future_Trends.pdf"
"53","Software_Metrics_Classification_for_Agile_Scrum_Process_A_Literature_Review.pdf","Software Metrics Classification for Agile Scrum Process: A Literature Review","","","Software metrics play an important role to measure every attributes and project success in software development context. In the scrum process, there are several events performed on each sprint in order to monitor team performance. Conducting an objective performance measurement in the agile process meet some challenges due to the differences in team preferences and project complexity. This paper discusses the software measurement metrics and their fundamental role in scrum software development life cycle. We review software metrics on scrum context based on 13 selected literatures. Software...","","","","6","29","","Proposta de Framework","Métricas de Software; Métodos Ágeis; Gerenciamento de Projetos; Produtividade","Story Points","Precisão/Recall/F1","Snowball/Scopus/IEEE Xplore","","Indústria; Educação","EN","../data/raw/artigos/Software_Metrics_Classification_for_Agile_Scrum_Process_A_Literature_Review.pdf"
"54","Source Code Metrics for Software Defects Prediction.pdf","Source Code Metrics for Software Defects Prediction","Dominik Arne Rebro, Bruno Rossi, and Stanislav Chren","2023","In current research, there are contrasting results about the ap- plicability of software source code metrics as features for defect prediction models. The goal of the paper is to evaluate the adop- tion of software metrics in models for software defect prediction, identifying the impact of individual source code metrics. With an empirical study on 275 release versions of 39 Java projects mined from GitHub, we compute 12 software metrics and collect software defect information. We train and compare three defect classifica- tion models. The results across all projects indicate that Decision T...","Software Defect Prediction, Software Metrics, Mining Software Repositories, Software Quality Accepted version of Dominik Arne Rebro, Bruno Rossi, and Stanislav Chren","10.1145/3555776.3577809","","6","30","39","Estudo Empírico; Machine Learning; Replicação; Mineração de Repositórios","Métricas de Software; Qualidade de Software; Predição de Defeitos","LOC/SLOC; Complexidade Ciclomática; Complexidade Cognitiva; Code Churn; Coupling/Acoplamento; Cohesion/Coesão; WMC; DIT; NOC; RFC; CK Metrics","Mann-Whitney; ANOVA; Kruskal-Wallis; Regressão Linear; Regressão Logística; Bayesiana; Descritiva; Box Plot; Random Forest; K-fold/Cross-validation; ROC/AUC; Precisão/Recall/F1","GitHub; Python; Java; scikit-learn","","Open Source; Acadêmico; Educação","EN","../data/raw/artigos/Source Code Metrics for Software Defects Prediction.pdf"
"55","THE GOAL QUESTION METRIC APPROACH.pdf","THE GOAL QUESTION METRIC APPROACH","","","","","","","10","0","5","Estudo de Caso; Proposta de Framework; GQM","Qualidade de Software; Processo de Software; Produtividade","LOC/SLOC; Defect Density","Precisão/Recall/F1","","GQM; McCall Model; Boehm Model","Indústria; Acadêmico","EN","../data/raw/artigos/THE GOAL QUESTION METRIC APPROACH.pdf"
"56","Techniques for Calculating Software Product Metrics Threshold Values A Systematic Mapping Study.pdf","Techniques for Calculating Software Product Metrics Threshold Values: A Systematic Mapping Study","Alok Mishra, Raed Shatnawi, Cagatay Catal and Akhan Akbulut","2021","Several aspects of software product quality can be assessed and measured using product metrics. Without software metric threshold values, it is difﬁcult to evaluate different aspects of quality. To this end, the interest in research studies that focus on identifying and deriving threshold values is growing, given the advantage of applying software metric threshold values to evaluate various software projects during their software development life cycle phases. The aim of this paper is to systematically investigate research on software metric threshold calculation techniques. In this study, ...","object-oriented metrics; software metrics; object-oriented measures; thresholds; systematic mapping; software quality","10.3390/app112311377","","25","200","","Mapeamento Sistemático","Métricas de Software; Qualidade de Software","CK Metrics","Regressão Logística; Descritiva; ROC/AUC","Java; Eclipse; Understand (SciTools); Snowball/Scopus/IEEE Xplore","","Indústria; Acadêmico","EN","../data/raw/artigos/Techniques for Calculating Software Product Metrics Threshold Values A Systematic Mapping Study.pdf"
"57","The Experimental Paradigm in Software Engeneering.pdf","The Experimental Paradigm in Software Engeneering","","","","","","","7","0","","","Engenharia de Software (Geral)","","","","","","EN","../data/raw/artigos/The Experimental Paradigm in Software Engeneering.pdf"
"58","The Space of Developer Productivity There's more to it than you think.pdf","eveloper productivity is complex and nuanced,","","2021","","","","","29","150","7","","Revisão de Código; Produtividade","","Precisão/Recall/F1","GitHub; Understand (SciTools)","DORA; SPACE Framework","Indústria; Acadêmico; Saúde/Healthcare","EN","../data/raw/artigos/The Space of Developer Productivity There's more to it than you think.pdf"
"59","The effects of change decomposition on code review --a controlled experiment.pdf","The effects of change decomposition on code review-a controlled experiment","Marco di Biase","2019","Background: Code review is a cognitively demanding and time-consuming process. Previous qualitative studies hinted at how decomposing change sets into multiple yet internally coherent ones would improve the reviewing process. So far, literature provided no quantitative analysis of this hypothesis. Aims: (1) Quantitatively measure the effects of change decomposition on the outcome of code review (in terms of number of found defects, wrongly reported issues, suggested improvements, time, and understanding); (2) Qualitatively analyze how subjects approach the review and navigate the code, buil...","","10.7717/peerj-cs.193","","25","132","28","Experimento Controlado; Replicação","Qualidade de Software; Manutenção de Software; Experimentação; Segurança de Software; Revisão de Código","","Teste t; Effect Size; Descritiva; Box Plot","GitHub; Java; Eclipse","","Open Source; Indústria; Acadêmico","EN","../data/raw/artigos/The effects of change decomposition on code review --a controlled experiment.pdf"
"60","The role of measurement uncertainty in the validation of a measurement procedure.pdf","The role of measurement uncertainty in the validation of a measurement procedure","Fernando C. Raposo","2024","","","10.1007/s00769-024-01593-y","","1","11","","","Engenharia de Software (Geral)","","Precisão/Recall/F1","","","Acadêmico","EN","../data/raw/artigos/The role of measurement uncertainty in the validation of a measurement procedure.pdf"
"61","Top Challenges from the first Practical Online Controlled Experiments Summit.pdf","Proceedings Template - WORD","End User Computing Services","2019","Online controlled experiments (OCEs), also known as A/B tests, have become ubiquitous in evaluating the impact of changes made to software products and services. While the concept of online controlled experiments is simple, there are many practical challenges in running OCEs at scale and encourage further academic and industrial exploration. To understand the top practical challenges in running OCEs at scale, representatives with experience in large-scale experimentation from thirteen different organizations (Airbnb, Amazon, Booking.com, Facebook, Google, LinkedIn, Lyft, Microsoft, Netflix,...","","","","16","77","","Experimento Controlado; Survey/Questionário","Experimentação","","Teste t; Regressão Linear; Regressão Logística; Bayesiana; Random Forest","","","Indústria; Acadêmico; Web/Mobile","EN","../data/raw/artigos/Top Challenges from the first Practical Online Controlled Experiments Summit.pdf"
"62","Towards Improving Experimentation in Software Engineering.pdf","Towards Improving Experimentation in Software Engineering","Edson OliveiraJr, Viviane Furtado, Henrique Vignando, Carlos Luz, André Cordeiro, Igor Steinmacher, Avelino Zorzo","2021","[Background:] Experimentation in Software Engineering plays a central role on sharing and verifying scientific findings. As ex- periments have increased significantly in Software Engineering area, we observe that most of them fail to provide a way to be repeated, replicated or reproduced, thus jeopardizing or delaying the evolution of the Software Engineering area. [Aims:] In this vision paper, we present and discuss techniques and infrastructure to continuously improve experiments towards repeatability, replica- bility, and reproducibility. [Method:] We define these techniques and infrastr...","Experimentation Improvement; Ontology, Repositories; Recom- mender Systems; Data Management Plans; Teaching/Learning; Con- tinuous Experimentation","10.1145/3474624.3477073","","6","20","2","Experimento Controlado; Meta-análise; Replicação","Engenharia de Software Empírica; Experimentação","","Teste t","GitHub; Python","","Indústria; Acadêmico; Educação","EN","../data/raw/artigos/Towards Improving Experimentation in Software Engineering.pdf"
"63","Unlocking inclusive education A quality assessment of software design in applications for children with autism.pdf","Unlocking inclusive education: A quality assessment of software design in applications for children with autism","Yussy Chinchay","2019","","","10.1016/j.jss.2024.112164","","14","165","295","Proposta de Framework","Engenharia de Software (Geral)","","Teste de Normalidade","SPSS; Understand (SciTools)","","Indústria; Acadêmico; Educação","EN","../data/raw/artigos/Unlocking inclusive education A quality assessment of software design in applications for children with autism.pdf"
"64","Unveiling Hybrid Cyclomatic Complexity A Comprehensive Analysis and Evaluation as an Integral Feature in Automatic Defect Prediction Models.pdf","Unveiling Hybrid Cyclomatic Complexity: A Comprehensive Analysis and Evaluation as an Integral Feature in Automatic Defect Prediction Models","Laura Diana Cernău; Laura Dioșan; Camelia Șerban;","2025","The complex software systems developed nowadays require assessing their quality and proneness to errors. Reducing code complexity is a never-ending problem, especially in today’s fast pace of software systems development. Therefore, the industry needs to find a method to determine the qualities of a software system, the degree of difficulty in developing new functionalities, or the system’s proneness to errors. One way of measuring and predicting the quality attributes of a software system is to analyse the software metrics values for it and the relationships between them. More precisely, w...","software metrics, code complexity, bug prediction Preprint submitted to Elsevier April 2, 2025 arXiv:2504.00477v1 [cs.SE]","","","23","21","","","Métricas de Software; Qualidade de Software; Manutenção de Software; Predição de Defeitos","LOC/SLOC; Complexidade Ciclomática","Correlação de Pearson; Bayesiana; Random Forest; SVM; Precisão/Recall/F1","GitHub; Python; Java; scikit-learn; Checkstyle","","Open Source; Indústria; Acadêmico","EN","../data/raw/artigos/Unveiling Hybrid Cyclomatic Complexity A Comprehensive Analysis and Evaluation as an Integral Feature in Automatic Defect Prediction Models.pdf"
"65","WEB_SYSTEM_FOR_METRICS_CONTROL_APPLYING_THE_GQM_ME.pdf","Web System for Metrics Control applying the GQM Method in a Software Development Center","Jesús Minero-Guardado","2025","","GQM; métricas; qualidade; sistema web","10.19053/01211129.v34.n72.2025.19104","","10","12","22","Proposta de Framework; GQM","Métricas de Software; Qualidade de Software","","","","GQM","Indústria; Web/Mobile; Financeiro","PT","../data/raw/artigos/WEB_SYSTEM_FOR_METRICS_CONTROL_APPLYING_THE_GQM_ME.pdf"
"66","Whats DAT Three Case Studies of Measuring Software.pdf","What's DAT? Three Case Studies of Measuring Software Development Productivity at Meta With Diff Authoring Time","Moritz Beller; Amanda Park; Karim Nakad; Akshay Patel; Sarita Mohanty; Ford Garberson; Ian G. Malone; Vaishali Garg; Henri Verroken; Andrew Kennedy; Pavel Avgustinov","2026","This paper introduces Diff Authoring Time (DAT), a precise, yet conceptually simple approach to measuring software development productivity that enables rigorous experimentation. DAT is a time- based metric, which assesses how much active work time engineers take to develop self-contained changes. It uses a bespoke telemetry system integrated with version control, the Integrated Development Environments, and the Operating System. We validate DAT through observational studies, surveys, visualizations, and descriptive statis- tics. At Meta, DAT elevates the internal tool development workflow ...","Diff Authoring Time, DAT, Developer Productivity, Engineering Velocity, Continuous Experimentation (CE)","10.1145/3786583.3786901","ICSE","12","63","20","Experimento Controlado; Estudo de Caso","Experimentação; Produtividade","LOC/SLOC; Function Points; Velocity","Teste t; Effect Size; Descritiva; K-fold/Cross-validation","GitHub; Java; Eclipse; GitHub Copilot; CodeLlama/LLaMA","McCall Model","Indústria","EN","../data/raw/artigos/Whats DAT Three Case Studies of Measuring Software.pdf"
